{
  "task_context": {
    "task_id": "user_center_demo_v2_20260329083615",
    "task_name": "user_center_demo_v2",
    "source_type": "file",
    "source_path": "analysis-module/examples/sample_requirement.md",
    "created_at": "2026-03-29T08:36:15.264991+00:00",
    "language": "zh-CN",
    "status": "received",
    "notes": []
  },
  "raw_requirement": "# 用户中心需求示例\n\n## 背景\n\n普通用户登录后进入用户中心页面。\n\n## 展示要求\n\n- 页面应显示用户昵称和会员等级。\n- 页面应显示最近订单入口。\n\n## 操作要求\n\n1. 用户点击“最近订单”后，应跳转到订单列表页。\n2. 用户在搜索框输入订单号后，应显示匹配的订单结果。\n\n## 约束\n\n- 未登录用户不能访问用户中心。\n- 搜索结果为空时应提示“未找到相关订单”。",
  "parsed_requirement": {
    "objective": "用户中心需求示例",
    "actors": [
      "普通用户",
      "用户"
    ],
    "entities": [
      "用户中心需求示例",
      "##",
      "背景",
      "普通用户登录后进入用户中心页面",
      "展示要求",
      "页面应显示用户昵称和会员等级",
      "页面应显示最近订单入口",
      "操作要求",
      "1.",
      "用户点击“最近订单”后"
    ],
    "preconditions": [
      "普通用户登录后进入用户中心页面",
      "未登录用户不能访问用户中心"
    ],
    "actions": [
      "用户点击“最近订单”后，应跳转到订单列表页",
      "用户在搜索框输入订单号后，应显示匹配的订单结果"
    ],
    "expected_results": [
      "页面应显示用户昵称和会员等级",
      "页面应显示最近订单入口",
      "搜索结果为空时应提示“未找到相关订单”"
    ],
    "constraints": [
      "未登录用户不能访问用户中心"
    ],
    "ambiguities": [
      "原始需求较短，建议补充业务目标、页面对象和断言细节"
    ],
    "source_chunks": [
      "chunk_003",
      "chunk_002",
      "chunk_001",
      "chunk_004"
    ]
  },
  "retrieved_context": [
    {
      "chunk_id": "chunk_003",
      "content": "1. 用户点击“最近订单”后，应跳转到订单列表页。\n2. 用户在搜索框输入订单号后，应显示匹配的订单结果。",
      "score": 12.0,
      "section_title": "操作要求",
      "source_file": "analysis-module/examples/sample_requirement.md"
    },
    {
      "chunk_id": "chunk_002",
      "content": "- 页面应显示用户昵称和会员等级。\n- 页面应显示最近订单入口。",
      "score": 7.0,
      "section_title": "展示要求",
      "source_file": "analysis-module/examples/sample_requirement.md"
    },
    {
      "chunk_id": "chunk_001",
      "content": "普通用户登录后进入用户中心页面。",
      "score": 4.0,
      "section_title": "背景",
      "source_file": "analysis-module/examples/sample_requirement.md"
    },
    {
      "chunk_id": "chunk_004",
      "content": "- 未登录用户不能访问用户中心。\n- 搜索结果为空时应提示“未找到相关订单”。",
      "score": 4.0,
      "section_title": "约束",
      "source_file": "analysis-module/examples/sample_requirement.md"
    }
  ],
  "scenarios": [
    {
      "scenario_id": "scenario_001",
      "name": "用户点击“最近订单”后，应跳转到订单列表页",
      "goal": "用户中心需求示例",
      "steps": [
        {
          "type": "given",
          "text": "普通用户登录后进入用户中心页面"
        },
        {
          "type": "when",
          "text": "用户点击“最近订单”后，应跳转到订单列表页"
        },
        {
          "type": "then",
          "text": "页面应显示用户昵称和会员等级"
        }
      ],
      "assertions": [
        "页面应显示用户昵称和会员等级"
      ],
      "source_chunks": [
        "chunk_003",
        "chunk_002",
        "chunk_001",
        "chunk_004"
      ],
      "priority": "P2",
      "preconditions": [
        "普通用户登录后进入用户中心页面",
        "未登录用户不能访问用户中心"
      ]
    },
    {
      "scenario_id": "scenario_002",
      "name": "用户在搜索框输入订单号后，应显示匹配的订单结果",
      "goal": "用户中心需求示例",
      "steps": [
        {
          "type": "given",
          "text": "普通用户登录后进入用户中心页面"
        },
        {
          "type": "when",
          "text": "用户在搜索框输入订单号后，应显示匹配的订单结果"
        },
        {
          "type": "then",
          "text": "页面应显示最近订单入口"
        }
      ],
      "assertions": [
        "页面应显示最近订单入口"
      ],
      "source_chunks": [
        "chunk_003",
        "chunk_002",
        "chunk_001",
        "chunk_004"
      ],
      "priority": "P1",
      "preconditions": [
        "普通用户登录后进入用户中心页面",
        "未登录用户不能访问用户中心"
      ]
    }
  ],
  "validation_report": {
    "feature_name": "user_center_demo_v2",
    "passed": true,
    "errors": [],
    "warnings": [],
    "metrics": {
      "scenario_count": 2,
      "average_step_count": 3.5,
      "step_count": 7
    }
  }
}